<?xml version="1.0" encoding="UTF-8"?>
<empresa xmlns:xsi="http://www.w3.org/2001/XMLSchema-instance" xsi:noNamespaceSchemaLocation="UD4_T5B_EloyRodalPerez.xsd">
  <empregado>
    <nome>Juan Pérez</nome>
    <departamento>Ventas</departamento>
    <NSS>123456789012</NSS>
    <contactos>987654321 123456789</contactos>
  </empregado>
  <empregado>
    <nome>Maria López</nome>
    <departamento>Recursos Humanos</departamento>
    <NSS>987654321098</NSS>
    <contactos>876543210 234567890</contactos>
  </empregado>
  <departamento codigo="001" xefe="2831239201389">
    <nome>Ventas</nome>
  </departamento>
  <departamento codigo="002" xefe="2843231239201389">
    <nome>Recursos Humanos</nome>
  </departamento>
</empresa>